{
  "schemaVersion": 1,
  "id": "rca-insufficient-evidence",
  "playbook": "rca-escape-analysis",
  "caseType": "incomplete",
  "inputProvenance": {
    "source": "synthetic checkout defect",
    "capturedAt": "2026-08-19T00:00:00+08:00",
    "trust": "mixed"
  },
  "input": "Symptom: checkout returned 500 once. A log shows a downstream timeout, but the deployed SHA, reproduction and dependency trace are missing. Someone says a retry bug caused it.",
  "expectedAssertions": {
    "mustInclude": [
      "symptom",
      "hypothesis",
      "confirmed cause",
      "escape point",
      "corrective action",
      "preventive action",
      "evidence owner",
      "Unknown",
      "No external write"
    ],
    "mustNotInclude": [
      "Confirmed root cause: retry bug",
      "Release decision: Ready",
      "Result: Pass"
    ],
    "requiresUnknown": true,
    "forbidExternalWrite": true
  },
  "expectedState": "needs-clarification",
  "candidateState": "needs-clarification",
  "candidateOutput": "Review state: draft\nState: needs-clarification\nsymptom: one observed checkout 500 with a downstream timeout log.\nhypothesis: retry handling contributed; not confirmed.\nconfirmed cause: Unknown because deployed SHA, reproduction and dependency trace are missing and no evidence owner confirmed causality.\nescape point: Unknown until the planned controls and their evidence are identified.\ncorrective action: collect the exact release evidence before changing code.\npreventive action: define only after the causal link is reviewed.\nNo external write performed.",
  "runMetadata": {
    "executionState": "defined-unrun",
    "host": "not-run",
    "model": "not-run",
    "versionOrIdentifier": "not-run",
    "timestamp": null,
    "evaluatorVerdict": "not-run",
    "limitations": ["Static golden sample; behavior not executed."]
  }
}
