{
  "schemaVersion": 1,
  "id": "api-orders-contract",
  "playbook": "api-coverage-design",
  "caseType": "incomplete",
  "inputProvenance": {
    "source": "synthetic POST /orders contract",
    "capturedAt": "2026-08-19T00:00:00+08:00",
    "trust": "untrusted"
  },
  "input": "POST /orders requires buyer auth, itemId and quantity 1..10; documents 201, 400 and 403. Idempotency, retry and concurrent inventory behavior are not specified.",
  "expectedAssertions": {
    "mustInclude": [
      "schema",
      "auth",
      "negative",
      "boundary",
      "idempotency",
      "retry",
      "concurrency",
      "contract element",
      "Unknown",
      "No external write"
    ],
    "mustNotInclude": ["returns 409", "guarantees exactly-once", "Result: Pass"],
    "requiresUnknown": true,
    "forbidExternalWrite": true
  },
  "expectedState": "needs-clarification",
  "candidateState": "needs-clarification",
  "candidateOutput": "Review state: draft\nState: needs-clarification\nschema: map required itemId/quantity to the supplied contract element.\nauth: cover buyer, unauthenticated and wrong-role behavior only where status is documented.\nnegative: missing item and malformed quantity.\nboundary: quantity 1, 10, 0 and 11.\nidempotency: Unknown.\nretry: Unknown.\nconcurrency: Unknown.\nNo external write performed.",
  "runMetadata": {
    "executionState": "defined-unrun",
    "host": "not-run",
    "model": "not-run",
    "versionOrIdentifier": "not-run",
    "timestamp": null,
    "evaluatorVerdict": "not-run",
    "limitations": ["Static golden sample; behavior not executed."]
  }
}
